{
  "step": 14,
  "classification": "LARGE",
  "status": "IN_PROGRESS",
  "gate_a": {
    "status": "APPROVED",
    "approved_by": "repository owner",
    "approved_at": "2026-09-05"
  },
  "gate_b": {
    "status": "NOT_REQUIRED",
    "approved_by": "repository owner",
    "approved_at": "2026-09-05",
    "reason": "Step14 changes development/SDD infrastructure only. No user-visible HEC feature or production hardware behavior requires a separate human functional preview. Automated mock runtime and Playwright validation provide the required runtime evidence."
  },
  "gate_c": {
    "status": "APPROVED",
    "approved_by": "repository owner",
    "approved_at": "2026-09-05"
  },
  "readiness": "YES",
  "requested_by": "repository owner / maintainer",
  "source": "HEC_POST_STEP13_REVIEW_REMAINING.md",
  "branch": "claude/step13-sdd-enforcement",
  "pr": null,
  "notes": "Close the operational SDD gaps identified after Step13. LAN read-only preview remains out of scope.",
  "requirements": [
    "REQ-014-001",
    "REQ-014-002",
    "REQ-014-003",
    "REQ-014-004",
    "REQ-014-005",
    "REQ-014-006",
    "REQ-014-007",
    "REQ-014-008",
    "REQ-014-009",
    "REQ-014-010",
    "REQ-014-011",
    "REQ-014-012"
  ],
  "acceptance": [
    "AC-014-001",
    "AC-014-002",
    "AC-014-003",
    "AC-014-004",
    "AC-014-005",
    "AC-014-006",
    "AC-014-007",
    "AC-014-008",
    "AC-014-009",
    "AC-014-010",
    "AC-014-011",
    "AC-014-012",
    "AC-014-013",
    "AC-014-014",
    "AC-014-015",
    "AC-014-016",
    "AC-014-017",
    "AC-014-018",
    "AC-014-019",
    "AC-014-020"
  ],
  "evidence": [
    "E-014-001",
    "E-014-002",
    "E-014-003",
    "E-014-004",
    "E-014-005",
    "E-014-006",
    "E-014-007",
    "E-014-008",
    "E-014-009",
    "E-014-010",
    "E-014-011",
    "E-014-012"
  ]
}
