{
  "step": 25,
  "classification": "LARGE",
  "status": "PLANNED",
  "gate_a": {
    "status": "APPROVED",
    "approved_by": "repository owner / maintainer (explicit user approval)",
    "approved_at": "2026-09-19T12:52:34.5442257+02:00"
  },
  "gate_b": {
    "status": "NOT_REQUESTED",
    "approved_by": null,
    "approved_at": null
  },
  "gate_c": {
    "status": "NOT_REQUESTED",
    "approved_by": null,
    "approved_at": null
  },
  "readiness": "YES",
  "requested_by": "repository owner / maintainer",
  "source": "User architecture review request on 2026-09-19: separate readers, telemetry storage, analytics, controllers, writers, and HEC dashboard; prepare a staged SDD migration plan.",
  "branch": null,
  "pr": null,
  "notes": "Approved as a long-term architecture plan. No application code, runtime configuration, production service, or device was changed. Implementation remains out of scope until a separately approved implementation step.",
  "requirements": [
    "REQ-025-001", "REQ-025-002", "REQ-025-003", "REQ-025-004",
    "REQ-025-005", "REQ-025-006", "REQ-025-007", "REQ-025-008"
  ],
  "acceptance": [
    "AC-025-001", "AC-025-002", "AC-025-003", "AC-025-004", "AC-025-005",
    "AC-025-006", "AC-025-007", "AC-025-008", "AC-025-009", "AC-025-010",
    "AC-025-011"
  ],
  "evidence": [
    "E-025-001", "E-025-002", "E-025-003", "E-025-004", "E-025-005",
    "E-025-006", "E-025-007", "E-025-008", "E-025-009", "E-025-010",
    "E-025-011", "E-025-012"
  ]
}
