{
  "step": 19,
  "classification": "LARGE",
  "status": "DONE",
  "gate_a": {
    "status": "APPROVED",
    "approved_by": "repository owner / maintainer",
    "approved_at": "2026-09-12T18:15:00+02:00",
    "reason": "Explicit human approval granted in chat for Step 19 implementation."
  },
  "gate_b": {
    "status": "APPROVED",
    "approved_by": "repository owner / maintainer",
    "approved_at": "2026-09-14T21:29:43+02:00"
  },
  "gate_c": {
    "status": "APPROVED",
    "approved_by": "repository owner / maintainer",
    "approved_at": "2026-09-14T21:29:43+02:00"
  },
  "readiness": "YES",
  "requested_by": "repository owner / maintainer",
  "source": "No-scroll Home / Today cockpit redesign request dated 2026-09-12",
  "branch": null,
  "pr": null,
  "notes": "Recommendation band remains in scope. The responsive layout corrections completed the owner-approved human and reviewer gates.",
  "requirements": [
    "REQ-019-001", "REQ-019-002", "REQ-019-003", "REQ-019-004",
    "REQ-019-005", "REQ-019-006", "REQ-019-007", "REQ-019-008",
    "REQ-019-009", "REQ-019-010", "REQ-019-011", "REQ-019-012",
    "REQ-019-013", "REQ-019-014"
  ],
  "acceptance": [
    "AC-019-001", "AC-019-002", "AC-019-003", "AC-019-004",
    "AC-019-005", "AC-019-006", "AC-019-007", "AC-019-008",
    "AC-019-009", "AC-019-010", "AC-019-011", "AC-019-012",
    "AC-019-013", "AC-019-014", "AC-019-015"
  ],
  "evidence": [
    "E-019-001", "E-019-002", "E-019-003", "E-019-004", "E-019-005",
    "E-019-006", "E-019-007", "E-019-008", "E-019-009", "E-019-010"
  ]
}