{
  "step": 16,
  "classification": "LARGE",
  "status": "IN_PROGRESS",
  "gate_a": {
    "status": "APPROVED",
    "approved_by": "human",
    "approved_at": "2026-09-13T00:00:00Z",
    "reason": "Explicit human approval received for the Step16 implementation scope, including the terminal status-output requirement for all reader and writer controllers."
  },
  "gate_b": {
    "status": "NOT_REQUESTED",
    "approved_by": null,
    "approved_at": null,
    "reason": "Human preview is not applicable before implementation."
  },
  "gate_c": {
    "status": "NOT_REQUESTED",
    "approved_by": null,
    "approved_at": null,
    "reason": "Completion review is not applicable before implementation."
  },
  "readiness": "YES",
  "requested_by": "repository owner / maintainer",
  "source": "APPROVED_STEP16_GOODWE_DESIGN",
  "branch": "sdd/step16-goodwe-implementation",
  "pr": null,
  "notes": "Gate A is explicitly approved. S01-S05 remain the frozen approved design, S06 is IN_PROGRESS / REVIEW under the practical household HEC safety model, and S07 remains a separate human/hardware verification gate before any live write or controller activation. Cryptographic authorization evidence, production GoodWe optimization rules, and detailed DBF header hardening are outside Step16.",
  "requirements": [
    "REQ-016-001",
    "REQ-016-002",
    "REQ-016-003",
    "REQ-016-004",
    "REQ-016-005"
  ],
  "acceptance": [
    "AC-016-001",
    "AC-016-002",
    "AC-016-003",
    "AC-016-004",
    "AC-016-005",
    "AC-016-006",
    "AC-016-007",
    "AC-016-008",
    "AC-016-009"
  ],
  "evidence": [
    "E-016-VALIDATION",
    "E-016-SAFETY",
    "E-016-NO-HARDWARE-WRITE"
  ]
}
