{
  "step": 12,
  "classification": "LARGE",
  "status": "CANCELLED",
  "gate_a": {
    "status": "PENDING",
    "approved_by": null,
    "approved_at": null
  },
  "gate_b": {
    "status": "NOT_REQUESTED",
    "approved_by": null,
    "approved_at": null
  },
  "gate_c": {
    "status": "NOT_REQUESTED",
    "approved_by": null,
    "approved_at": null
  },
  "readiness": "NO",
  "requested_by": "repository owner / maintainer",
  "source": "HEC_STEP12_SDD_HARDENING.md",
  "branch": null,
  "pr": null,
  "notes": "Cancelled as a standalone implementation step and superseded operationally by Step14. Its historical planning and negative-fixture evidence remains preserved; the repository SDD is closed by the later Step14 implementation.",
  "requirements": [
    "REQ-SDD-001",
    "REQ-SDD-002",
    "REQ-SDD-003",
    "REQ-SDD-004",
    "REQ-SDD-005",
    "REQ-SDD-006",
    "REQ-SDD-007",
    "REQ-SDD-008",
    "REQ-SDD-009",
    "REQ-SDD-010"
  ],
  "acceptance": [
    "AC-SEC-001",
    "AC-SEC-002",
    "AC-SDD-001",
    "AC-SDD-002",
    "AC-SDD-003",
    "AC-SDD-004",
    "AC-GATE-001",
    "AC-GATE-002",
    "AC-PREVIEW-001",
    "AC-PREVIEW-002",
    "AC-CI-001",
    "AC-CI-002",
    "AC-SAFE-001",
    "AC-SAFE-002",
    "AC-GATE-003",
    "AC-DOGFOOD-001"
  ],
  "evidence": [
    "E-SDD-001",
    "E-SDD-002",
    "E-SDD-003",
    "E-SDD-004",
    "E-SDD-005"
  ]
}
