{
  "step": 33,
  "classification": "LARGE",
  "status": "DONE",
  "gate_a": {
    "status": "APPROVED",
    "approved_by": "repository owner: Udělej to celé",
    "approved_at": "2026-10-22T14:15:39.4733000+02:00"
  },
  "gate_b": {
    "status": "APPROVED",
    "approved_by": "independent reviewer /root/release_review; code 9ab4302c7848105561e7ed634951664468501200; no unresolved IMPORTANT/BLOCKER; complete exact-head push CI and 14 smoke green",
    "approved_at": "2026-10-22T16:05:43.470637+02:00"
  },
  "gate_c": {
    "status": "APPROVED",
    "approved_by": "repository owner: Ok, násaď to. Schvaluji; Můžeš to nasadit?; Pokračuj",
    "approved_at": "2026-10-22T15:17:49.176263+02:00"
  },
  "readiness": "YES",
  "requested_by": "repository owner / maintainer",
  "source": "Owner screenshots; whole Step33 plan approved, deployment explicitly approved 2026-10-22",
  "branch": "claude/step33-overview-accuracy-plan",
  "pr": "https://github.com/MartinDybalUniwise/Home-Energy-Controller/pull/44",
  "notes": "HEC0.1.6 deployed and verified in production on desktop/mobile; six sources fresh, config unchanged, controller disabled. Complete source CI437unit/111Chromium PASS; local66Edge/25targeted PASS; independent review and owner Human Gate APPROVED. Incremental copy33379961B; metadata reload copied0B.",
  "requirements": [
    "REQ-033-001",
    "REQ-033-002",
    "REQ-033-003",
    "REQ-033-004",
    "REQ-033-005",
    "REQ-033-006"
  ],
  "acceptance": [
    "AC-033-001",
    "AC-033-002",
    "AC-033-003",
    "AC-033-004",
    "AC-033-005",
    "AC-033-006"
  ],
  "evidence": [
    "E-033-001",
    "E-033-002",
    "E-033-003",
    "E-033-004",
    "E-033-005",
    "E-033-006"
  ]
}
