{
  "step": 27,
  "classification": "SMALL",
  "status": "IN_PROGRESS",
  "gate_a": {
    "status": "APPROVED",
    "approved_by": "repository owner; souhlasÃƒÂ­m with preceding chat plan",
    "approved_at": "2026-10-20T17:33:34.601390+02:00"
  },
  "gate_b": {
    "status": "PENDING",
    "approved_by": null,
    "approved_at": null
  },
  "gate_c": {
    "status": "PENDING",
    "approved_by": null,
    "approved_at": null
  },
  "readiness": "YES",
  "requested_by": "repository owner / maintainer",
  "source": "Explicit owner approval in chat: souhlasÃƒÂ­m",
  "branch": "claude/step27-validation-contracts",
  "pr": "https://github.com/MartinDybalUniwise/Home-Energy-Controller/pull/41",
  "notes": "Implementation commit 3a0cb7825439ff0a7651cf3f205e7f219f61af60; draft PR #41 on Step26. Full local validation PASS; exact code CI Python 3.11/3.12 and SDD full browser validation PASS. Reviewer and Human Gate pending; production unchanged.",
  "requirements": [
    "REQ-027-001",
    "REQ-027-002",
    "REQ-027-003"
  ],
  "acceptance": [
    "AC-027-001",
    "AC-027-002",
    "AC-027-003"
  ],
  "evidence": [
    "E-027-001",
    "E-027-002",
    "E-027-003"
  ]
}
