{
  "step": 26,
  "classification": "LARGE",
  "status": "IN_PROGRESS",
  "gate_a": {
    "status": "APPROVED",
    "approved_by": "repository owner; explicit chat approval: schvaluji a začni implementaci",
    "approved_at": "2026-10-20T16:24:14.9424728+02:00"
  },
  "gate_b": {
    "status": "PENDING",
    "approved_by": null,
    "approved_at": null
  },
  "gate_c": {
    "status": "PENDING",
    "approved_by": null,
    "approved_at": null
  },
  "readiness": "YES",
  "requested_by": "repository owner / maintainer",
  "source": "Owner request 2026-10-20; USER_REQUEST.txt",
  "branch": "claude/step26-history-performance-version",
  "pr": "https://github.com/MartinDybalUniwise/Home-Energy-Controller/pull/40",
  "notes": "Gate A approved. Code committed/pushed with draft PR #40 against production integration branch. Offline repair, complete DBF replay and repeat verified. Required CI/full_validation FAIL on reproduced baseline unit defects; one baseline browser failure. Review/Human Gate, release/tag and production deployment remain pending.",
  "requirements": [
    "REQ-026-001",
    "REQ-026-002",
    "REQ-026-003",
    "REQ-026-004",
    "REQ-026-005",
    "REQ-026-006",
    "REQ-026-007",
    "REQ-026-008"
  ],
  "acceptance": [
    "AC-026-001",
    "AC-026-002",
    "AC-026-003",
    "AC-026-004",
    "AC-026-005",
    "AC-026-006",
    "AC-026-007",
    "AC-026-008"
  ],
  "evidence": [
    "E-026-001",
    "E-026-002",
    "E-026-003",
    "E-026-004",
    "E-026-005",
    "E-026-006",
    "E-026-007",
    "E-026-008"
  ]
}
