{
  "step": 22,
  "classification": "LARGE",
  "status": "PLANNED",
  "gate_a": {
    "status": "APPROVED",
    "approved_by": "repository owner / maintainer (explicit user approval)",
    "approved_at": "2026-09-14T20:03:03.2662711+02:00"
  },
  "gate_b": {
    "status": "NOT_REQUESTED",
    "approved_by": null,
    "approved_at": null
  },
  "gate_c": {
    "status": "NOT_REQUESTED",
    "approved_by": null,
    "approved_at": null
  },
  "readiness": "YES",
  "requested_by": "repository owner / maintainer",
  "source": "User request to check the SDG runtime issue and prepare a repair plan dated 2026-09-14",
  "branch": null,
  "pr": null,
  "notes": "Planning only. Runtime evidence indicates successful historical SDG imports but no currently running HEC Python process; slow polls take approximately 90-98 seconds while the configured interval is 10 seconds.",
  "requirements": [
    "REQ-022-001", "REQ-022-002", "REQ-022-003", "REQ-022-004",
    "REQ-022-005"
  ],
  "acceptance": [
    "AC-022-001", "AC-022-002", "AC-022-003", "AC-022-004",
    "AC-022-005", "AC-022-006", "AC-022-007", "AC-022-008",
    "AC-022-009"
  ],
  "evidence": [
    "E-022-001", "E-022-002", "E-022-003", "E-022-004",
    "E-022-005", "E-022-006", "E-022-007", "E-022-008",
    "E-022-009"
  ]
}
