{
  "step": 18,
  "classification": "LARGE",
  "status": "DONE",
  "gate_a": {
    "status": "APPROVED",
    "approved_by": "repository owner / maintainer",
    "approved_at": "2026-09-12T10:00:00.000+00:00",
    "reason": "Explicit human approval granted for Step18 implementation according to approved SDD planning package and visual references."
  },
  "gate_b": {
    "status": "APPROVED",
    "approved_by": "repository owner / maintainer",
    "approved_at": "2026-09-14T21:29:43+02:00"
  },
  "gate_c": {
    "status": "APPROVED",
    "approved_by": "repository owner / maintainer",
    "approved_at": "2026-09-14T21:29:43+02:00"
  },
  "readiness": "YES",
  "requested_by": "repository owner / maintainer",
  "source": "UI/UX Redesign request based on authoritative visual references",
  "branch": "sdd/step18-ui-redesign",
  "pr": null,
  "notes": "Step18 UI/UX redesign for the 11\" touchscreen wall display was completed after owner-approved human and reviewer gates.",
  "requirements": [
    "REQ-018-001",
    "REQ-018-002",
    "REQ-018-003",
    "REQ-018-004",
    "REQ-018-005",
    "REQ-018-006",
    "REQ-018-007",
    "REQ-018-008",
    "REQ-018-009",
    "REQ-018-010"
  ],
  "acceptance": [
    "AC-018-001",
    "AC-018-002",
    "AC-018-003",
    "AC-018-004",
    "AC-018-005",
    "AC-018-006",
    "AC-018-007",
    "AC-018-008",
    "AC-018-009"
  ],
  "evidence": [
    "E-018-001",
    "E-018-002",
    "E-018-003",
    "E-018-004",
    "E-018-005",
    "E-018-006",
    "E-018-007",
    "E-018-008",
    "E-018-009"
  ]
}
