{
  "step": 13,
  "classification": "LARGE",
  "status": "CANCELLED",
  "gate_a": {
    "status": "APPROVED",
    "approved_by": "repository owner",
    "approved_at": "2026-09-04"
  },
  "gate_b": {
    "status": "NOT_REQUESTED",
    "approved_by": null,
    "approved_at": null
  },
  "gate_c": {
    "status": "NOT_REQUESTED",
    "approved_by": null,
    "approved_at": null
  },
  "readiness": "YES",
  "requested_by": "repository owner / maintainer",
  "source": "HEC_POST_STEP12_REVIEW_REMAINING.md",
  "branch": "claude/step13-sdd-enforcement",
  "pr": null,
  "notes": "Cancelled as a standalone implementation step and superseded operationally by Step14, which completed the SDD enforcement, security-owner evidence, merge protection, and final dogfood closure.",
  "requirements": [
    "REQ-013-001",
    "REQ-013-002",
    "REQ-013-003",
    "REQ-013-004",
    "REQ-013-005",
    "REQ-013-006",
    "REQ-013-007",
    "REQ-013-008",
    "REQ-013-009",
    "REQ-013-010",
    "REQ-013-011"
  ],
  "acceptance": [
    "AC-013-001",
    "AC-013-002",
    "AC-013-003",
    "AC-013-004",
    "AC-013-005",
    "AC-013-006",
    "AC-013-007",
    "AC-013-008",
    "AC-013-009",
    "AC-013-010",
    "AC-013-011",
    "AC-013-012",
    "AC-013-013",
    "AC-013-014"
  ],
  "evidence": [
    "E-013-001",
    "E-013-002",
    "E-013-003",
    "E-013-004",
    "E-013-005",
    "E-013-006",
    "E-013-007",
    "E-013-008",
    "E-013-009",
    "E-013-010",
    "E-013-011"
  ]
}
